{
  "protocolVersion": "0",
  "requestId": "req-prefab-instantiate-1",
  "ok": true,
  "result": {
    "mutationId": "prefab-instantiate-example-1",
    "replayed": false,
    "prefabGuid": "8a7f7a7f8c15476ebf7a50b5c9049f11",
    "prefabPath": "Packages/com.eunsung.unity-ai-bridge/Tests/Editor/Fixtures/PrefabWorkflowFixture.prefab",
    "expectedPrefabDependencyHash": "0123456789abcdef0123456789abcdef",
    "globalObjectId": "GlobalObjectId_V1-2-99c9720ab356a0642a771bea13969a05-100-0",
    "instanceId": 12345,
    "name": "PrefabWorkflowFixture",
    "hierarchyPath": "PrefabWorkflowFixture",
    "sceneName": "SampleScene",
    "scenePath": "Assets/Scenes/SampleScene.unity",
    "siblingIndex": 2,
    "expectedStateEpoch": "example-state-epoch",
    "expectedStateRevision": 42,
    "stateEpoch": "example-state-epoch",
    "stateRevision": 43
  },
  "warnings": [],
  "changedTargets": [
    {
      "globalObjectId": "GlobalObjectId_V1-2-99c9720ab356a0642a771bea13969a05-100-0",
      "instanceId": 12345,
      "name": "PrefabWorkflowFixture"
    }
  ],
  "dirtyState": "dirty",
  "undo": {
    "available": true,
    "groupName": "Unity AI Bridge: Instantiate Prefab"
  },
  "compileState": "idle"
}
