{
  "protocolVersion": "0",
  "requestId": "fixture-component-inspect",
  "ok": true,
  "result": {
    "gameObject": {
      "globalObjectId": "GlobalObjectId_V1-2-0123456789abcdef0123456789abcdef-1-0",
      "instanceId": 101,
      "name": "Target",
      "activeSelf": true,
      "activeInHierarchy": true,
      "childCount": 0,
      "sceneName": "SampleScene",
      "scenePath": "Assets/Scenes/SampleScene.unity",
      "hierarchyPath": "Target",
      "siblingIndex": 0,
      "sceneIsDirty": false,
      "stateEpoch": "fixture-epoch",
      "stateRevision": 12
    },
    "componentCount": 1,
    "returnedComponentCount": 1,
    "missingScriptCount": 0,
    "truncatedByComponentLimit": false,
    "maxComponents": 8,
    "maxPropertiesPerComponent": 32,
    "maxDepth": 3,
    "components": [
      {
        "index": 0,
        "missingScript": false,
        "globalObjectId": "GlobalObjectId_V1-2-0123456789abcdef0123456789abcdef-2-0",
        "instanceId": 202,
        "typeName": "UnityEngine.Transform",
        "assemblyQualifiedName": "UnityEngine.Transform, UnityEngine.CoreModule",
        "scriptAssetPath": "",
        "returnedPropertyCount": 3,
        "truncatedByPropertyLimit": false,
        "truncatedByDepth": false,
        "properties": [
          {
            "path": "m_LocalPosition",
            "displayName": "Position",
            "depth": 0,
            "propertyType": "Vector3",
            "isArray": false,
            "arraySize": -1,
            "hasVisibleChildren": true,
            "valueKind": "vector3",
            "stringValue": "(0,0,0)",
            "longValue": 0,
            "doubleValue": 0,
            "boolValue": false,
            "objectReferenceGlobalObjectId": "",
            "objectReferenceInstanceId": 0,
            "objectReferenceName": "",
            "objectReferenceType": ""
          },
          {
            "path": "m_LocalRotation",
            "displayName": "Rotation",
            "depth": 0,
            "propertyType": "Quaternion",
            "isArray": false,
            "arraySize": -1,
            "hasVisibleChildren": true,
            "valueKind": "quaternion",
            "stringValue": "(0,0,0,1)",
            "longValue": 0,
            "doubleValue": 0,
            "boolValue": false,
            "objectReferenceGlobalObjectId": "",
            "objectReferenceInstanceId": 0,
            "objectReferenceName": "",
            "objectReferenceType": ""
          },
          {
            "path": "m_LocalScale",
            "displayName": "Scale",
            "depth": 0,
            "propertyType": "Vector3",
            "isArray": false,
            "arraySize": -1,
            "hasVisibleChildren": true,
            "valueKind": "vector3",
            "stringValue": "(1,1,1)",
            "longValue": 0,
            "doubleValue": 0,
            "boolValue": false,
            "objectReferenceGlobalObjectId": "",
            "objectReferenceInstanceId": 0,
            "objectReferenceName": "",
            "objectReferenceType": ""
          }
        ]
      }
    ],
    "stateEpoch": "fixture-epoch",
    "stateRevision": 12
  },
  "warnings": [],
  "dirtyState": "unchanged",
  "compileState": "idle"
}
