{
  "protocolVersion": "0",
  "requestId": "00000000-0000-4000-8000-000000000001",
  "ok": true,
  "result": {
    "unityVersion": "6000.3.21f1",
    "projectName": "FixtureProject",
    "activeScene": "Assets/Scenes/SampleScene.unity",
    "isPlaying": false,
    "isPaused": false,
    "isPlayingOrWillChangePlaymode": false,
    "playModeState": "edit",
    "enterPlayModeOptionsEnabled": true,
    "disableDomainReload": false,
    "disableSceneReload": false,
    "isCompiling": false,
    "agentVersion": "0.0.1",
    "capabilities": [
      "editor.status",
      "editor.playMode.set",
      "state.revision.v1"
    ],
    "stateEpoch": "fixture-epoch",
    "stateRevision": 12
  },
  "warnings": [],
  "dirtyState": "unchanged",
  "compileState": "idle"
}
